{
  "$schema": "http://json-schema.org/draft-07/schema#",
  "title": "backend_service",
  "type": "object",
  "required": [
    "summary",
    "files",
    "tests",
    "notes"
  ],
  "properties": {
    "summary": {
      "type": "string"
    },
    "files": {
      "type": "array",
      "items": {
        "type": "object",
        "required": [
          "path",
          "language",
          "content"
        ],
        "properties": {
          "path": {
            "type": "string"
          },
          "language": {
            "type": "string"
          },
          "content": {
            "type": "string"
          }
        }
      }
    },
    "tests": {
      "type": "array",
      "items": {
        "type": "string"
      }
    },
    "notes": {
      "type": "array",
      "items": {
        "type": "string"
      }
    }
  }
}
