{
  "summary": "Exemple de bundle (UI + tests)",
  "files": [
    {
      "path": "src/components/ProductCard.tsx",
      "language": "typescript",
      "content": "// ..."
    },
    {
      "path": "tests/ProductCard.test.ts",
      "language": "typescript",
      "content": "// ..."
    }
  ],
  "tests": [
    "npm test"
  ],
  "notes": [
    "Blueprint: ...",
    "ComplexityProfile: ...",
    "CREDIT_LOG: ..."
  ]
}
